{
  "$schema": "https://json-schema.org/draft/2020-12/schema",
  "$id": "https://countershape.dev/spec/schema/v1/reduction-run.schema.json",
  "title": "Countershape ReductionRun v1 canonical body",
  "description": "The exact semantic-body shape emitted by internal/reduce for one bounded run. The transcript is a separate canonical artifact named by transcript_digest. This run carries only the inward weak draft grade UNCHANGED or BEST_KNOWN; it never carries ONE_MINIMAL_UNDER or durable-store authority. JSON Schema validation checks inert shape only and cannot establish measure-digest reconstruction, transcript linkage, accepted-path consistency, execution freshness, or any reduction grade.",
  "$comment": "artifact_digest is intentionally absent: the typed ReductionRun digest is computed outside its own canonical hash preimage.",
  "type": "object",
  "additionalProperties": false,
  "required": [
    "schema_version",
    "kind",
    "baseline_outcome_map_digest",
    "baseline_preservation_map_digest",
    "original_stimulus_digest",
    "minimized_stimulus_digest",
    "original_measure_digest",
    "original_measure_components",
    "minimized_measure_digest",
    "minimized_measure_components",
    "reducer_set_digest",
    "measure_definition_digest",
    "scope_digest",
    "proposal_limit",
    "candidate_trial_limit",
    "wall_limit_ms",
    "transcript_digest",
    "grade",
    "limitations",
    "global_minimum_claimed",
    "root_cause_claimed"
  ],
  "properties": {
    "schema_version": { "const": "countershape/v1" },
    "kind": { "const": "ReductionRun" },
    "baseline_outcome_map_digest": {
      "description": "Typed OutcomeArtifactDigest of the original divergent baseline artifact.",
      "$ref": "common.schema.json#/$defs/Digest"
    },
    "baseline_preservation_map_digest": {
      "description": "Typed PreservationMapDigest of the original complete eligible labeled map. It is distinct from baseline_outcome_map_digest and is not independently a preservation decision.",
      "$ref": "common.schema.json#/$defs/Digest"
    },
    "original_stimulus_digest": { "$ref": "common.schema.json#/$defs/Digest" },
    "minimized_stimulus_digest": { "$ref": "common.schema.json#/$defs/Digest" },
    "original_measure_digest": { "$ref": "common.schema.json#/$defs/Digest" },
    "original_measure_components": { "$ref": "#/$defs/MeasureComponents" },
    "minimized_measure_digest": { "$ref": "common.schema.json#/$defs/Digest" },
    "minimized_measure_components": { "$ref": "#/$defs/MeasureComponents" },
    "reducer_set_digest": {
      "description": "Binds adapter domain, reducer rule names and versions, measure definition, and exact reduction scope.",
      "$ref": "common.schema.json#/$defs/Digest"
    },
    "measure_definition_digest": { "$ref": "common.schema.json#/$defs/Digest" },
    "scope_digest": { "$ref": "common.schema.json#/$defs/Digest" },
    "proposal_limit": { "type": "integer", "minimum": 1, "maximum": 200 },
    "candidate_trial_limit": { "type": "integer", "minimum": 1, "maximum": 2000 },
    "wall_limit_ms": { "type": "integer", "minimum": 1, "maximum": 3600000 },
    "transcript_digest": { "$ref": "common.schema.json#/$defs/Digest" },
    "grade": {
      "description": "Pure reducer draft grade only. The outward durable grade is a separate ReductionGrade artifact.",
      "enum": ["UNCHANGED", "BEST_KNOWN"]
    },
    "limitations": {
      "type": "array",
      "uniqueItems": true,
      "items": { "type": "string", "minLength": 1 }
    },
    "global_minimum_claimed": { "const": false },
    "root_cause_claimed": { "const": false }
  },
  "$defs": {
    "MeasureComponents": {
      "type": "array",
      "minItems": 1,
      "maxItems": 32,
      "items": { "type": "integer", "minimum": 0, "maximum": 9007199254740991 }
    }
  }
}
