{
  "schema_version": "countershape/v1",
  "kind": "ReductionRun",
  "baseline_outcome_map_digest": "sha256:1010101010101010101010101010101010101010101010101010101010101010",
  "baseline_preservation_map_digest": "sha256:2020202020202020202020202020202020202020202020202020202020202020",
  "original_stimulus_digest": "sha256:3030303030303030303030303030303030303030303030303030303030303030",
  "minimized_stimulus_digest": "sha256:4040404040404040404040404040404040404040404040404040404040404040",
  "original_measure_digest": "sha256:5050505050505050505050505050505050505050505050505050505050505050",
  "original_measure_components": [2, 2],
  "minimized_measure_digest": "sha256:6060606060606060606060606060606060606060606060606060606060606060",
  "minimized_measure_components": [1, 1],
  "reducer_set_digest": "sha256:7070707070707070707070707070707070707070707070707070707070707070",
  "measure_definition_digest": "sha256:8080808080808080808080808080808080808080808080808080808080808080",
  "scope_digest": "sha256:9090909090909090909090909090909090909090909090909090909090909090",
  "proposal_limit": 10,
  "candidate_trial_limit": 20,
  "wall_limit_ms": 60000,
  "transcript_digest": "sha256:a0a0a0a0a0a0a0a0a0a0a0a0a0a0a0a0a0a0a0a0a0a0a0a0a0a0a0a0a0a0a0a0",
  "grade": "BEST_KNOWN",
  "limitations": [],
  "global_minimum_claimed": false,
  "root_cause_claimed": false
}
